"ID_GROUPES_PATIENT","NOM","DESCRIPTION_FR","DESCRIPTION_EN","REMARQUES_FR","REMARQUES_EN",,,,,
852,"8108-1","1 enfant de 7 mois avec allergie à la viande de bœuf sans allergie au lait de vache","A 7 month old child with allergy to beef meat without allergy to cow's milk",,,,,,,
853,"8115-1","OAS jujube chez une femme TC positive latex mais non allergique latex","Oral allergy syndrome to jujube in a woman ST+ to latex but not allergic to latex",,,,,,,
854,"8183-1","Sujets Espagnols allergiques à l'olivier et Autrichiens allergiques au frêne","Spanish subjects allergic to olive pollen and Austrians allergic to ash tree pollen",,,,,,,
855,"8183-2","Sujets Espagnols allergiques à l'olivier et Autrichiens allergiques au frêne","Spanish subjects allergic to olive pollen and Austrians allergic to ash tree pollen",,,,,,,
856,"8202-1","Patients allergiques à l'arachide","Patients allergic to peanuts",,,,,,,
857,"8202-2","Patients allergiques à la noix du Brésil","Patients allergic to Brazil nuts",,,,,,,
858,"8202-3","Patient allergique aux fruits à coque","Patients allergic to tree nuts",,,,,,,
859,"8205-1","Sujets exposés professionnellement à la papaïne","Subjects occupationally exposed to papain",,,,,,,
860,"8205-2","Sujets exposés professionnellement à la broméline et à la papaïne","Subjects occupationally exposed to bromelin and papain",,,,,,,
862,"8207-1","Professionnels avec asthme du boulanger","Workers with baker's asthma",,,,,,,
863,"8209-1","Polliniques au bouleau avec allergie à la pomme","Birch pollinosis patients with allergy to apple",,,,,,,
864,"8212-1","Sélection des sujets = ?","Selection of subjects = ??",,,,,,,
865,"8213-1","Patients avec réaction systémique (ou loco-régionale) à un piqûre de guêpe Polistes","Paients with systemic reactions (or local-regional reactions) to a Polistes wasp sting",,,,,,,
866,"8214-1","Patients allergiques au venin de Vespula","Patients allergic to Vespula venom",,,,,,,
867,"8215-1","Polliniques à l'acacia","Patients with acacia pollinosis",,,,,,,
868,"8217-1","Patients avec réaction systémique après piqûre par une guêpe (Vespula ou Dolichovespula)","Patients with a systemic reaction after a wasp sting (Vespula or Dolichovespula)",,,,,,,
869,"8221-1","Patients avec asthme professionnel à la farine","Patients with occupational allergy to flour",,,,,,,
870,"8224-1","Allergie professionnelle au pollen de tournesol","Occupational allergy to sunflower pollen",,,,,,,
871,"8227-1",,,"Pas de RC testée ou méthodologie non conforme","CR not assayed or non-conforming method",,,,,
872,"8234-1","Sujets ayant un asthme professionnel du à la poussière de bois d'abachi","Subjects with occupational allergy to abachi (Triplochiton scleroxylon) wood dust ",,,,,,,
873,"8237-1","Asthme professionnel au soja","Occupational allergy to soya",,,,,,,
874,"8238-1","Patients TC positifs pour les phanères de différents mammifères","Patients ST+ for various mammalian danders",,,,,,,
875,"8239-1","Allergie respiratoire et alimentaire aux lentilles et pois chiches","Respiratory and food allergy to lentils and chickpeas",,,,,,,
876,"8241-1","Boulangers","Bakers",,,,,,,
877,"8246-1",,,"Ab","Ab",,,,,
878,"8248-1",,,"Manquent détails (résumé possésé seulement)","Details missing (only the abstract available)",,,,,
879,"8257-1","Sujets IgE+ pour Euroglyphus","Subjects IgE+ for Eurogluphus",,,,,,,
880,"8261-1","Patients non sensibilisés au latex et présentant une allergie à la figue","Patients not sensitized to latex but with allergy to fig",,,,,,,
881,"8313-1","Sujets polliniques aux graminées","Grass pollinosis patients",,,,,,,
882,"8325-1","sujets allergiques aux crustacés","Subjects allergic to shellfish",,,,,,,
883,"8330-1","Enfants avec histoire clinique d'allergie immédiate à la farine de céréales","Children with a clinical history of immediate allergy to cereal flour",,,,,,,
884,"8332-1","Asthme/rhinoconjonctivite avec RAST positif Chortoglyphus et D ptero","Asthma/rhinoconjunctivitis and RAST+ for Chortoglyphus and D. pteronyssinus",,,,,,,
885,"8346-1",,,"Données inexploitables","Data inexploitable",,,,,
886,"8351-1",,,"Données inexploitables","Data inexploitable",,,,,
887,"8353-1","Sujets avec allergie au lait de chèvre/brebis sans allergie au lait de vache","Subjects with allergy to goat's/sheep milk without allergy to cow's milk",,,,,,,
888,"8363-1",,,"Données inexploitables","Data inexploitable",,,,,
889,"8391-1",,,"Pas de RC testée ou méthodologie non conforme","CR not assayed or non-conforming method",,,,,
890,"8417-1","Patients allergiques à l'amande","Patients allergic to almond",,,,,,,
891,"8420-1","Allergiques à la noix, avec histoire clinique positive pour noisette et noix de cajou","Patients allergic to walnuts with a positive clinical history for hazelnut and cashew nut",,,,,,,
892,"8430-1","Patients polliniques à Cupressus sempervirens","Patients with Cupressus sempervirens pollinosis","Nb de sujets RC+ déduit de la Fig 6","Number of CR+ subjects inferred from Fig 6",,,,,
893,"8463-1","Patients polliniques aux graminées","Patients with grass pollinosis",,,,,,,
894,"8468-1","Sujest RAST positifs pour la polygalacturonase du lis","Subjects RAST+ for lily polygalacturonase",,,,,,,
895,"8525-1","Sujets positifs pour Cladosporium et Alternaria","Subjects + for Cladosporium and Alternaria",,,,,,,
896,"8529-1","Sujets allergiques au venin de Vespula et porteurs d'IgE anti-CCD (broméline et HRP positives)","Subjects allergic to Vespula venom and with anti-CCD IgE (bromelin and HRP +)",,,,,,,
897,"8529-2","Sujet allergique au venin d'abeille et porteur d'IgE anti-CCD (broméline et HRP positives)","Subjects allergic to bee venom and with anti-CCD IgE (bromelin and HRP +)",,,,,,,
898,"8539-1","Asthme professionnel","Occupational asthma",,,,,,,
899,"8554-1","Eczéma atopique avec réactivité pour Malassezia","Atopic eczema with reactivity to Malassezia",,,,,,,
900,"8558-1","Allergie au chien","Allergy to dogs",,,,,,,
901,"8590-1","Polliniques au platane","Plantain pollinosis",,,,,,,
902,"8596-1","Allergie au chat","Allergy to cats",,,,,,,
903,"8604-1","1 patient avec allergie au chat puis allergie au porc","One patient with cat allergy and, later, pork allergy",,,,,,,
904,"8608-1","Sujets allergiques aux crustacés","Subjects allergic to shellfish",,,,,,,
905,"8620-1","Sujets allergiques au latex et positifs pour nHev b 13","Subjects allergic to latex and + for nHev b 13",,,,,,,
906,"8636-1","Sujets polliniques à Senecio jacobea","Subjects with Senecio jacobea pollinosis",,,,,,,
907,"8641-1","Allergiques à la tomate et pollinique genévrier","Subjects allergic to tomato and with juniper pollinosis",,,,,,,
908,"8668-1","Sujets avec TC natif positif pour la tomate et les feuilles de cannabis","Subjects with +ST for tomato and canabis leaves",,,,,,,
909,"8669-1",,,"Données inexploitables","Data inexploitable",,,,,
910,"8676-1","Polliniques TC positifs pour diverses Astéracées","Subjects with pollinosis with +ST for various Asteraceae",,,,,,,
911,"8685-1","Patient pollinique présentant un syndrome oral avec l'oignon","A pollinosis patient presenting with an oral allergy syndrome to onion",,,,,,,
912,"8714-1","Allergie alimentaire au riz dans le cadre d'un syndrome LTP","Food allergy to rice as part of an oral allergy syndrome to onion",,,,,,,
913,"8715-1","Allergiques au raisin (2/3 d'enfants)","Subjects allergic to grapes (2/3 children)",,,,,,,
914,"8715-2","Allergiques au raisin (2/3 d'enfants)","Subjects allergic to grapes (2/3 children)",,,,,,,
915,"8727-1",,,"Manquent détails dans l'article","Missing details in the article",,,,,
916,"8730-1","Allergiques au chat","Subjects allergic to cats",,,,,,,
917,"8749-1","Anaphylaxie provoquée par l'usage d'un savon parfumé aux agrumes","Anaphylaxis caused by the use of soap containing citrus fruit perfume",,,,,,,
918,"8765-1","Asthme professionnel du à Penicillium camemberti","Occupational asthma to Penicillim camemberti",,,,,,,
919,"8783-1","Allergie à la courgette et au navet chez un adulte allergique au latex (exposé) et à des ""fruits latex""","Allergy to zucchini and turnip in an adult allergic to latex (exposed) and to ""latex fruits""",,,,,,,
920,"8793-1","Allergie au guépard","An allergy to cheetah",,,,,,,
921,"8796-1","Enfants allergiques à l'arachide présentant une réactivité clinique pour le fenugrec","Children allergeic to peanuts presenting with clinical reactivity to fenugreek",,,,,,,
922,"8796-2","Enfant allergique à l'arachide présentant une réactivité cutanée (sans allergie) pour le fenugrec","A child allergic to peanuts presenting with a skin reaction (without allergy) to fenugreek",,,,,,,
923,"8797-1",,,"Pas de RC testée ou méthodologie non conforme","CR not assayed or non-conforming method",,,,,
924,"8798-1","Enfant allergique au lait de soja et pollinique au bouleau","A child allergic to soymilk and with birch pollinosis",,,,,,,
925,"8799-1",,,"Pas de RC testée ou méthodologie non conforme","CR not assayed or non-conforming method",,,,,
926,"8815-1","Allergiques aux Vespides avec TC positif pour Vespula et Polistes dominulus","Subjects allergic to wasps with ST+ for Vespula and Polistes dominulus",,,,,,,
927,"8842-1","Sujet allergique au pouce-pied et à la crevette","A subject allergic to goose barnacles and shrimp",,,,,,,
928,"8845-1","Enfants avec allergie au lait de vache","Children with allergy to cow's milk",,,,,,,
929,"8847-1","sujets TC positifs pariétaire et carde","Subjects ST+ to wall pellitory and cardoon",,,,,,,
930,"8863-1","Allergie professionnelle à l'œuf","Occupational allergy to egg",,,,,,,
931,"8867-1","Patients allergiques au sésame et IgE+ pour rJug r 4","Patients allergic to sesame and IgE+ for rJug r 4",,,,,,,
932,"8881-1","Sujets ""sensibilisés"" à la soude mais TC négatifs pour le chénopode","Subjects ""sensitized"" to barilla but ST− to goosefoots",,,,,,,
933,"8899-1",,,"Manquent détails (résumé possésé seulement)","Details missing (only the abstract available)",,,,,
934,"8945-1","Professionnel exposé aux poussières de bois","Workers exposed to wood dust",,,,,,,
935,"8946-1","Allergie professionnelle à la racine de chicorée","Occupational allergy to endive roots",,,,,,,
936,"8959-1","Un cas d'anaphylaxie à la grenade","A case of anaphylaxis to pomagranate",,,,,,,
937,"8962-1",,,"Pas de RC testée ou méthodologie non conforme","CR not assayed or non-conforming method",,,,,
938,"8964-1","Un cas d'allergie à la chérimole chez une femme allergique au latex","A case of custard-apple allergy in a woman allergic to latex",,,,,,,
939,"8976-1","Anaphylaxie à une solution de camomille","Anaphylaxis to a camomile solution",,,,,,,
940,"8980-1","Adultes allergiques à la moutarde","Adults allergic to mustard",,,,,,,
941,"9002-1","Réaction anaphylactique à la noix de coco chez un enfant allergique à la noix","An anaphylactic reaction to coconut in a child allergic to walnuts",,,,,,,
942,"9009-1","Patiente présentant une anaphylaxie à l'ingestion de mandarine","A patient presenting with anaphylaxis after eating a manderine",,,,,,,
943,"9076-1","Allergie au lupin (TPODA) et à l'arachide","Allergy to lupin (DBOFC) and to peanut",,,,,,,
944,"9076-2","Allergie au lupin (TPODA) sans allergie à l'arachide ni aux autres Fabacées","Allergy to lupin (DBOFC) without peanut allegy nor allergy to other Fabaceae",,,,,,,
945,"9099-1","Patients avec APLV persistante et allergie aux phanères de mammifères","Patients with persistent APLV ?? and allergy to mammalian danders",,"Mammalian danders",,,,,
946,"9105-1","Syndrome oral à l'ingestion de graines de lupin","Oral allergy syndrome on eating lupin beans",,,,,,,
947,"9117-1",,,"Pas de RC testée ou méthodologie non conforme","CR not assayed or non-conforming method",,,,,
948,"9120-1","Patients allergiques au sarrasin","Patients allergic to buckwheat",,,,,,,
949,"9179-1","Patient pollinique au bouleau, sans allergie alimentaire","Patients with birch pollinosis but without food allergy",,,,,,,
950,"9223-1","Patients avec asthme du boulanger, sans allergie pour la pêche mais IgE+ pour Pru p 3","Patients with baker's asthma and IgE+ for Pru p 3 but without allergy to peach",,,,,,,
951,"9234-1",,,"Manquent détails dans l'article","Missing details in the article",,,,,
952,"9267-1","Patients avec réactivité cutanée et/ou sérique pour des phanères de mammifères","Patients with skin and/or serum reactivity for mammalian danders",,,,,,,
953,"9283-1",,,"Pas de RC testée ou méthodologie non conforme","CR not assayed or non-conforming method",,,,,
954,"9358-1","Polliniques au bouleau et allergiques au litchi","Birch pollinosis and allergy to lychee",,,,,,,
955,"9388-1",,,"Manquent détails (résumé possésé seulement)","Details missing (only the abstract available)",,,,,
956,"9418-1","Patients avec anaphylaxie au blé induite par l'effort et réactivité cutanée pour Saccharomyces","Patients with wheat-dependent exercise-induced anaphylaxis and cutaneous reactivity to Saccharomyces",,,,,,,
957,"9472-1","Syndrome porc-chat s'étendant au poulet","Pork-cat syndrome extending to chicken",,,,,,,
958,"9717-1","Patiente présentant une allergie respiratoire et une allergie de contact avec le riz cru","A patient with respiratory allergy and contact allergy to raw rice",,,,,,,
959,"844-1","Infirmière allergique au latex","A nurse allergic to latex",,,,,,,
960,"3133-1","1 patient avec anaphylaxie à l'acérola","One patient with anaphylaxis to acerola",,,,,,,
961,"8882-1","Patients allergiques aux crevettes","Patients allergic to shrimp",,,,,,,
962,"10293-1","Anaphylaxie au thon (cru) et au makaire (blue marlin)","Anaphylaxis to raw tunafish and to blue marlin",,,,,,,
963,"9834-1","Allergiques à la morue","Allergy to cod",,,,,,,
964,"9928-1","Patients allergiques aux blattes","Patients allergic to cockroaches",,,,,,,
965,"9925-1","1 enfant avec anaphylaxie à la volaille et à l'oeuf induite par l'exercice","One child with exercise-induced anaphylaxis to poultry and to egg ",,,,,,,
966,"9695-1","Patients avec allergie au poisson (Espagne, Pays-Bas, Grêce)","Patients with fish allergy (Spain, The Netherlands and Greece)",,,,,,,
967,"9100-1","Patient allergique aux crevettes","Patients allergic to shrimp",,,,,,,
968,"9937-1","Patients allergiques au saumon","Patients allergic to salmon",,,,,,,
969,"9218-1","Patient allergique aux crustacés","Patients allergic to crustaceans",,,,,,,
970,"9302-1",,,"Manquent détails (résumé possésé seulement)","Details missing (only the abstract available)",,,,,
971,"9188-1",,,"Pas de RC testée ou méthodologie non conforme","CR not assayed or non-conforming method",,,,,
972,"8046-1",,,"Pas de RC testée ou méthodologie non conforme","CR not assayed or non-conforming method",,,,,
973,"9380-1",,,"Pas de RC testée ou méthodologie non conforme","CR not assayed or non-conforming method",,,,,
974,"5152-1","Allergie à des œufs de poisson, sans allergie à la chair de poisson","Allergy to fish eggs, without allergy to fish meat",,,,,,,
975,01/01/2011,"Patients doublement positifs pour l'abeille et la guêpe Vespula","Patients doubly + for bees and Vespula wasps",,,,,,,
980,"10001-1",,,"Pas de RC testée","CR not assayed",,,,,
981,"10003-1","Enfant allergique aux acariens et aux crustacés et mollusques","Children allergic to mites and to crustaceans and mollusks","L'inhibition de blot est très tangente, en tout cas pour un rôle de tropos","Inhibition in the blot is very borderline, in any case for a role of tropos [",,,,,"tropomysins??"
982,"1009-1","Patients allergiques au thon","Patients allergic to tunafish",,,,,,,
983,"10128-1",,,"Sélection douteuse des érums et effet de CCD même pas évoqué !","Doubtful selection of sera, and the effect of CCD not even considered",,,,,
984,"10137-1","Patients polliniques (bouleau, etc..) avec allergie à la mangue","Patients with pollinosis (birch, et al.) with allergy to mango",,,,,,,
985,"1014-1","Patients allergiques à la pomme et à la pêche","Patients allergic to apple and peach",,,,,,,
986,"10168-1","Adultes avec asthme du boulanger et syndrome oral kiwi","Adults with baker's asthma and oral allergy syndrome to kiwi",,,,,,,
987,"10181-1","Enfants avec dermatite atopique et présentant un TC positif pour les graines de Brassica rapa (navette)","Children with atopic dermatitis and with a +ST for Brassica rapa (turnip)",,,,,,,
988,"10195-1",,,"utilisation d'antisérums et non de sérums humains","Antisera, not human sera, were used",,,,,
989,"10196-1",,,"RC entre une 66kD de Prosopis (de nature = ?) et des pollens très exotiques (et le haricot du cap) ! De plus, probable arte-fact CCD",,,,,,
990,"10201-1","Patients polliniques aux graminées","Patients with grass pollinosis",,,,,,,
991,"10204-1","Patients CAP positifs pour bouleau, hêtre et chêne","Patients CAP+ for birch, beech and oak",,,,,,,
992,"10234-1","Urticaire généralisée après ingestion de banane chez un enfant de 6 mois","Generalized urticaria in a 6 month's old child after eating banana",,,,,,,
993,"10267-1",,,"pas de RC testée","CR not assayed",,,,,
994,"10275-1","Patients avec ABPA","Patients with ABPA",,,,,,,
995,"10303-1",,,,,,,,,
996,"10346-1",,,"Utilisation d'un mAb","A mAb was used",,,,,
997,"10352-1","Anaphylaxie après ingestion de mangue fraîche, sous IT armoise","Anaphylaxis after eating fresh mango while receiving mugwort IT",,,,,,,
998,"10367-1","Patients allergiques au chien","Patients allergic to dog",,,,,,,
999,"10389-1","Patients allergiques à Cladosporium herbarum","Patients allergic to Cladosporium herbarum",,,,,,,
1000,"10399-1",,,"ni blot ni inhibitions : parler d' ""allergie croisée"" est bien exagéré","neither blot nor inhibition: to speak of ""cross allergy"" is greatly exaggerated",,,,,
1001,"1040-1","Patient pollinique (graminées et pariétaire)","A pollinosis patient (due to grass and wall pellitory)",,,,,,,
1002,"1042-1",,,"Utilisation d'un Ab","An Ab was used",,,,,
1003,"10421-1","Patients polliniques au bouleau et allergiques au kiwi (TPODA)","Patients with birch pollinosis and allergy to kiwi (DBOFC)",,,,,,,
1004,"10429-1","Patients avec réaction systémique à Polistes","Patients with a systemic reaction to Polistes",,,,,,,
1005,"10441-1",,,,,,,,,
1006,"10444-1",,,,,,,,,
1007,"10453-1",,,"manque de précisions : inhib de tomate ou peau ?","poor precision: inhibition of tomato or skin?",,,,,
1008,"10455-1",,,"manque de précisions : inhib de tomate ou peau ?","poor precision: inhibition of tomato or skin?",,,,,
1009,"10470-1","Anaphylaxie après ingestion de myrtilles","Anaphylaxis after eating blueberries",,,,,,,
1010,"10476-1",,,"RC notée chez 1 patient mais sens = ??","CR noted in one patient, but what does it mean?",,,,,
1011,"10488-1","Patients allergiques à la noix de cajou","Patients allergic to cashew nuts",,,,,,,
1012,"10546-1",,,"Manquent précisions pour saisie RC","Insufficient precision to accept cross-reactivity",,,,,
1013,"10580-1","Enfants avec ATCD d'anaphylaxie au lait de vache (et non exposés au chien ni au chat)","Children wIth ATCD ?? and anaphylaxis induced by cow's milk (and not exposed to dogs or cats)",,,,,,,
1014,"10580-2","Enfants avec ATCD d'anaphylaxie au lait de vache (non exposés au chien, exposés au chat)","Children with ATCD ?? and anaphylaxis induced by cow's milk (and exposed to cats but not to dogs)",,,,,,,
1015,"10593-1","Adultes allergiques aux Rosacées et ayant présenté une anaphylaxie à la laitue",,,,,,,,
1016,"10605-1",,,"RC limités selon les auteurs entre Tyr p 3 et Der p 3 ou Blomia : mais data not shown","Limited CR between Try p 3 and Der p 3 or Blomia, according to the authors, but the data are not shown",,,,,
1017,"10606-1","Patients allergiques au ver à soie","Patients allergic to silk worms",,,,,,,
1018,"10644-1","Fillette 10 ans avec allergie au porc (non cuit) après introduction d'un hamster au domicile","A 10 year old girl who became allergic to raw pork after introduction of a hamster in her house",,,,,,,
1019,"10653-1",,,"manquent détails (résumé)","Details missing (abstract)",,,,,
1020,"10656-1","Un enfant avec anaphylaxie après ingestion d'une graine de citrouille (ATCD idem avec noix du Brésil)","A child with anaphylaxis after eating pumpkin seeds (ATCD ditto with Brazil nuts)",,,,,,,
1021,"10657-1","Patients polliniques au bouleau","Patients with birch pollinosis",,,,,,,
1022,"10658-1","Patients allergiques aux acariens et TC+ D. ptero et Lepidoglyphus","Patients allergic to mites and ST+ to D. ptero and Lepidoglyphus",,,,,,,
1023,"1066-1",,,"Pas de Rc testée","CR not assayed",,,,,
1024,"10660-1","Allergie respiratoire à des animaux domestiques aggravée après introduction de furets au domicile","Respiratory allergy to domestic animals becoming worse after introduction of ferrets in the house",,,,,,,
1025,"10681-1","Adultes avec syndrome oral (n=4) ou asthme à la cuisson (n=1) avec les haricots verts","Adults with oral allergy syndrome (n=4) or asthma when cooking string beans",,,,,,,
1026,"10686-1","Enfant de 14 ans avec anaphylaxie alimentaire (blé, pomme, laitue) et forte réactivité LTP de pêche","A 14 year old child with food-induce anaphylaxis (wheat, apple, lettuce) and strong reactivity to peach LTP)",,,,,,,
1027,"10687-1","Patiente allergique au latex avec anaphylaxie au concombre (et ATCD réaction avec papaye)","A patient allergic to latex with anaphylaxis to cucumber (and an ATCD reaction to papaya)",,,,,,,
1028,"10694-1","Test cutané positif pour S. kali et/ou S. oppositifolia et/ou Chenopodium album","ST+ for Saxifraga kali and/or S. oppositifolia and/or Chenopodium album",,,,,,,
1029,"10713-1","Patients polliniques au frêne et ""sensibilisés"" à la tomate","Patients with ash pollinosis who are ""sensitized"" to tomato",,,,,,,
1030,"10719-1","Enfant avec réaction urticarienne après ingestion de noix de coco (idem avec lentilles)","A child with an urticarial reaction after eating coconut (ditto with lentils)",,,,,,,
1031,"1072-1","Patients polliniques à la pariétaire","Patients with pollinosis to wall pellitory",,,,,,,
1032,"10720-1",,,"Manquent précisions pour saisie RC","Insufficient precision to accept cross-reactivity",,,,,
1033,"10732-1","Sujets exposés à des animaux de laboratoire et RAST+ pour rat et souris","Subjects exposed to laboratory animals and RAST+ for rat and mouse",,,,,,,
1034,"10755-1","Anaphylaxie alimentaire à la coriandre dans un contexte d'allergie professionnelle aux épices","Food-induced anaphylaxis due to coriander in the context of occupational allergy to spices",,,,,,,
1035,"10803-1",,,"Technique d'inhibition bizarre. Critères de sélection des patients disparates","Inhibition technique bizarre. Patient selection criteria disparate",,,,,
1036,"10810-1","Allergie professionnelle à la poudre de racine de chicorée","Occupational allergy to endive root powder",,,,,,,
1037,"10811-1","Patients allergiques au lupin et à l'arachide","Patients allergic to lupin and to peanut",,,,,,,
1038,"10822-1","Patients polliniques au pin","Patients with pine pollinosis",,,,,,,
1039,"10822-2","Patients polliniques au pin et ""sensibilisés"" aux graminées","Patients with pine pollinosis and ""sensitivity"" to grasses",,,,,,,
1040,"10834-1","Patient avec anaphylaxie au miel de tournesol (et ATCD syndrome oral céleri)","Patients with anaphylaxis to sunflower honey (and ATCD oral allergy syndrome to celery)",,,,,,,
1041,"1088-1",,,"utilisation d'un mAb","A mAb was used",,,,,
1042,"1090-2","Patient allergique à la guêpe","Patients allergic to wasps",,,,,,,
1043,"10986-1","Patients avec réaction systémique après piqûre par une guêpe Vespula","Patients with a systemic reaction after being stung by a Vespula wasp",,,,,,,
1045,"123-1",,,"Données inexploitables : pas d’espèce précisée pour aucun des produits testés !","Data inexploitable: species not specified for any of the products assayed",,,,,
1046,"1231-1",,,"Utilisation d'un Ab","An Ab was used",,,,,
1047,"126-1",,,"RC testée au niveau T",,,,,,
1048,"1273-1","Patients polliniques aux graminées","Patients with grass pollinosis",,,,,,,
1049,"131-1",,,"Utilisation d'un mAb","A mAb was used",,,,,
1050,"132-1",,,"Utilisation d'un Ab","An Ab was used",,,,,
1051,"1331-1",,,"Pas de RC testée","CR not assayed",,,,,
1052,"1436-1","Patients allergiques au poisson","Patients allergic to fish",,,,,,,
1053,"144-1",,,"pas d'indications précises dans le résumé",,,,,,
1054,"146-1","Suspicion d'allergie aux Vespides (avec RAST Vespula > Polistes)","Suspicion of allergy to Vespidae (with RAST to Vespula > Polistes",,,,,,,
1055,"1462-1",,,"Pas de RC testée","CR not assayed",,,,,
1056,"1482-1",,,"Pas de Rc testée","CR not assayed",,,,,
1057,15/01/2011,,,"Pas de RC testée","CR not assayed",,,,,
1058,"1523-1","Anaphylaxie à l'escargot chez une enfant sous IT acariens","Anaphylaxis to snail in a child undergoing IT to mites","l'article ne précise pas l'espèce de ""prawn"" qui est présentée non croisante avec acariens","The article did not specify the species of ""prawn"" which was not cross-reacting with mites",,,,,
1059,"1536-1",,,,,,,,,
1060,"1592-1",,,"aucune indication d'espèces et RC+ en blot mais pas en ELISA","The species not given and a +CR on the blot but not by ELISA",,,,,
1061,"165-1",,,"RC testées chez la souris","CR assayed in mice",,,,,
1062,"1719-1","Enfant allergique au moustique","A child allergic to mosquitos",,,,,,,
1063,"1743-1",,,"Pas de RC testée","CR not assayed",,,,,
1064,18/01/2011,,,"il a été utilisé une fraction ""GCR3"" de blatte","The ""GCR3"" cockraoch fraction was used",,,,,
1065,"1805-1","Patient allergique au miel","A patient allergic to honey",,,,,,,
1066,"1805-2","Patient allergique au miel et à l'abeille","A patient allergic to honey and bees",,,,,,,
1067,"182-1",,,"Utilisation d'un mAb","A mAb was used",,,,,
