"ID_GROUPES_PATIENT","NOM","DESCRIPTION_FR","DESCRIPTION_EN","REMARQUES_FR","REMARQUES_EN",,,,,
414,"1468-1","Patients allergiques au chien et au chat","Patients allergic to dog and cat",,,,,,,
415,"1473-1",,,"Manquent détails dans l'article","Details missing in the article",,,,,
416,"1485-1","Patients avec un test cutané positif pour le chiendent digité","Patients with a +ST for Bermuda grass",,,,,,,
417,"1487-1","Sujets avec allergie respiratoire et TC positif chat, négatifs en albumines","Subjects with respiratory allergy and +ST to cat, − to albumin",,,,,,,
418,"1487-2","Sujets avec allergie respiratoire et TC positif chat, positifs en albumines","Subjects with respiratory allergy and +ST to cat, + to albumin",,,,,,,
419,"1492-1",,,"Données inexploitables","Data inexploitable",,,,,
420,"1499-1","Sujets polliniques présentant une réactivité pour les pollens de dactyle et d'olivier","Pollinosis subjects presenting with reactivity for orchard grass and olive",,,,,,,
421,"1505-1","Sujets allergiques à l'arachide","Subjects allergic to peanuts and CAP+ to wheat and corn flour",,,,,,,
422,"1509-1","Allergie respiratoire avec exposition au chat et/ou au chien","Respiratory allergy on exposure to cat and/or dog",,,,,,,
423,"1513-1","Sujets avec double positivité abeille-guêpe en CAP","Subjects CAP+ to both bee and wasp ",,,,,,,
424,"1532-1","Adultes allergiques à la courgette","Adults allergic to zucchini",,,,,,,
425,"1537-1","Patient mono-pollinique (armoise) et présentant des réactions à la pistache","A patient with pollinosis only to mugwort presenting with reactions to pistachio",,,,,,,
426,"1544-1","Patient allergique à Cladosporium et Alternaria","A patient allergic to Cladosporium and Alternaria",,,,,,,
427,"1556-1","Sujets allergiques au latex et CAP positifs Ficus","Subjects allergic to latex and CAP+ for Ficus",,,,,,,
428,"1583-1","Sujets positifs in vitro pour l'abeille et pour PLA2 (nApi m 1)","Subjects + in vitro for bee and for PLA2 (nApi m 1)",,,,,,,
429,"1602-1","Allergie de contact puis alimentaire avec la carotte","Contact allergy and then food allergy to carrot",,,,,,,
430,"1626-1",,,"Manquent détails dans l'article","Details missing in the article",,,,,
431,"1627-1","Patients sensibilisés au latex d'Hevea","Patients sensitized to Hevea latex",,,,,,,
432,"1632-1","Sujets allergiques à l'œuf de poule","Subjects allergic to chicken egg",,,,,,,
433,"1656-1","Enfants positifs in vitro pour arachide, soja, lentille et pois chiche","Children + in vitro to peanut, soybeans, lentils and chickpea",,,,,,,
434,"1658-1","Enfants allergiques à l'arachide (n'ayant jamais eu de contact avec les noix et les amandes)","Children allergic to peanut (never having had contact with walnuts or almonds",,,,,,,
435,"1658-2","Sujets allergiques à l'arachide et aux fruits à coque","Subjects allergic to peanut and to tree nuts",,,,,,,
436,"1661-1","1 patient allergique aux viandes de bœuf, agneau et porc avec TC+","One patient allergic to beef, lamb and pork meat with +ST",,,,,,,
437,"1662-1","Patients allergiques aux noix","Patients allergic to walnuts",,,,,,,
438,"1663-1",,,,,,,,,
439,"1664-1","Patients ayant présenté une anaphylaxie au blé induite par l'effort","Patients having presented with anaphylaxis to wheat induced by exercise",,,,,,,
440,"1667-1","Patients allergiques au bouleau","Patients allergic to birch",,,,,,,
441,"1668-1",,,"Manquent détails dans l'article","Details missing in the article",,,,,
442,"1675-1","Sujets positifs pour l'aulne et le genévrier","Subjects + for alder and juniper",,,,,,,
443,"1700-1","Sujets positifs pour le plantain","Subjects + for plantain",,,,,,,
444,"1701-1",,,"Manquent détails dans l'article","Details missing the article",,,,,
445,"1703-1","Patients polliniques aux graminées","Patients with grass pollinosis",,,,,,,
446,"1707-1","Patient allergique au manioc, non atopique","A nonatopic patient allergic to manioc",,,,,,,
447,"1713-1",,,"Données inexploitables","Data inexploitable",,,,,
448,"1714-1","Allergiques au sarrasin","Subjects allergic to buckwheat",,,,,,,
449,"1727-1","Polliniques olivier","Subjects with olive pollinosis",,,,,,,
450,"1728-1","Patient asthmatique","Asthmatic patients",,,,,,,
451,"1731-1","Sujets avec syndrome armoise-céleri et RAST positif mangue","Subjects with the mugwort-celery syndrome and a RAST+ for mango",,,,,,,
452,"1736-1","Sujets positifs in vitro pour les acariens testés","Subjects + in vitro for the mites assayed",,,,,,,
453,"1736-2","Sujets positifs in vitro pour les acariens testés","Subjects + in vitro for the mites assayed",,,,,,,
454,"1740-1","Allergique aux haricots verts","Subjects allergic to string beans",,,,,,,
455,"1798-1",,,"Pas de RC testée ou méthodologie non conforme","CR not assayed or non-conforming method",,,,,
456,"1804-1","Allergie à différentes Lactucées","Allergy to various Lactuceae (Cichorieae)",,,,,,,
457,"1807-1","Sujets avec syndrome armoise-épices","Subjects with the mugwort-spices syndrome",,,,,,,
458,"1815-1","Sujets allergiques au latex (spina bifida et personnel soignant)","Subjects allergic to latex (spina bifida and health care personnel",,,,,,,
459,"1820-1","Polliniques au bouleau avec allergie à la noisette","Subjects with birch pollinosis and allergy to hazelnut",,,,,,,
460,"1848-1","Patients allergiques au latex et RAST positifs pour les énolases","Patients allergig to latex and RAST+ for enolases",,,,,,,
461,"1856-1","Sujets professionnellement exposés et allergiques au latex","Subjects occupationally exposed and allergic to latex",,,,,,,
462,"1882-1","Patients allergiques aux graminées","Patients allergic to grasses and/or to wheat flour",,,,,,,
463,"1888-1","Patients allergiques à la cerise","Patients allergic to cherries",,,,,,,
464,"1889-1","Patients polliniques et allergiques au kaki (TPODA positif)","Patients with pollinosis who are allergic to persimmon (DBOFC+)",,,,,,,
465,"1902-1",,,"Pas de RC testée ou méthodologie non conforme","CR not assayed or non-conforming method",,,,,
466,"1936-1","Enfants avec dermatite atopique","Children with atopic dermatitis",,,,,,,
467,"1939-1","Patients avec allergie au céleri (TPODA)","Patients allergic to celery (DBOFC+)",,,,,,,
468,"1956-1","Patients allergiques aux Hyménoptères avec réaction anaphylactique à P. chinensis","Patients allergic to Hymenoptera with an anaphylactic reaction to P.chinensis",,,,,,,
469,"1965-1","Patients avec asthme/rhinite","Patients with asthma/rhinitis",,,,,,,
470,"1966-1","Boulanger avec rhinite/asthme et TC+ acariens","A baker with rhintis/asthma and ST+ to mites",,,,,,,
471,"1968-1","Fermiers avec allergie respiratoire et au moins 1 TC+ acariens","Farmers with respiratory allery and at least one +ST to mites",,,,,,,
472,"1969-1","Sujets polliniques avec symptômes perannuels","Pollinosis subjects with perennial symptoms",,,,,,,
473,"1972-1",,,"Pas de RC testée ou méthodologie non conforme","CR not assayed or non-conforming method",,,,,
474,"1987-1","Anaphylaxie à l'ingestion de chérimole chez une infirmière allergique au latex","Anaphylaxis after ingestion of Chirimuya",,,,,,,
475,"2001-1","Allergie au lupin","Allergy to lupin",,,,,,,
476,"2009-1","Patient avec pollinose au tilleul et TC positif pour d'autres pollens","A patient with pollinosis to tilia and ST+ for other pollen",,,,,,,
477,"2025-1","Histoire d'allergie aux poissons avec RAST+","A history of allergy to fish with a +RAST",,,,,,,
478,"2028-1","Sujets allergiques au latex ou à Aspergillus, avec un ELISA positif pour rHev b 10","Subjects allergic to latex or Aspergillus, with an ELISA + for rHev b 10",,,,,,,
479,"2030-1","Un patient avec allergie alimentaire pour la banane et urticaire au contact du Ficus et de l'arbre à pain","A patient with food allergy to banana and urticaria on contact with ficus and breadfruit",,,,,,,
480,"2046-1","Sujets allergiques à la prune (et pour beaucoup à d'autres rosacées)","Subjects allergic to prune (and many also allergic to other Rosaceae)",,,,,,,
481,"2068-1","Allergie au bouleau et à la poire","Allergy to birch and pear",,,,,,,
482,"2071-1","Polliniques bouleau avec syndrome oral","Birch pollinosis and oral allergy syndrome",,,,,,,
483,"2085-1","Episodes d'urticaire généralisée dus à la bière","Episodes of generalized urticaria due to beer",,,,,,,
484,"2089-1","9 patients allergiques à l'œuf TC ou TPO +","Nine patients allergic to egg with a +ST or OFC",,,,,,,
485,"2096-1","patients allergiques aux plumes d'oiseaux et au jaune d'œuf","Patients allergic to bird feathers and egg yolk",,,,,,,
486,"2100-1","Sujets allergiques au lait de vache et IgE+ pour le lait de chèvre","Subjects allergic to cow's milk and IgE+ for goat's milk",,,,,,,
487,"2138-1",,,"Manquent détails (résumé possésé seulement)","Details missing (only the abstract available)",,,,,
488,"2144-1","Asthme à l'inhalation de poudre de psyllium","Asthma following inhalation of psyllium powder",,,,,,,
489,"2173-1","Sujet non pollinique allergique à l'oignon (cru)","A subject allergic to raw onion but not to pollen",,,,,,,
490,"2174-1","Sujets allergiques à la carotte (TPODA)","Subjects allergic to carrot (DBOFC)",,,,,,,
491,"2176-1","Sujets allergiques au latex et positifs pour rHev b 8","Subjects allergic to latex and + for rHev b 8",,,,,,,
492,"2177-1","Patient allergique au sésame","A patient allergic to sesame",,,,,,,
493,"2178-1","Pollinose armoise","Mugwort pollinosis",,,,,,,
494,"2182-1","Une infirmière allergique au latex et présentant des réactions alimentaires avec les Drupacées","A nurse allergic to latex presenting with food reaction to Drupaceae",,,,,,,
495,"2183-1","Histoire d'allergie aux poissons avec RAST+","A history of allergy to fish with a +RAST",,,,,,,
496,"2184-1",,,"Données inexploitables","Data inexploitable",,,,,
497,"2185-1","Allergie au saumon","Allergy to salmon",,,,,,,
498,"2187-1","Allergiques au céleri avec TC positifs bouleau et/ou armoise","Subjects allergic to celery with +ST to birch and/or mugwort",,,,,,,
499,"2191-1","1 patients allergique aux fromages de chèvre et de brebis sans allergie au lait de vache","One patient allergic to goat and sheep cheeses without allergy to cow's milk",,,,,,,
500,"2192-1",,,"Pas de RC testée ou méthodologie non conforme","CR not assayed or non-conforming method",,,,,
501,"2199-1","Allergie aux pignons de pin chez un patient présentant un syndrome œuf-oiseaux","Allergy to pine seeds in a patient presenting an egg-bird syndrome",,,,,,,
502,"2201-1","Sensibilisation professionnelle à la farine d'épeautre","Occupational allergy to spelt flour",,,,,,,
503,"2221-1","Fermiers avec TC+ Tetranychus urticae ou Panonychus ulmi et RAST+ D ptero","Farmers with A +ST to Tetrenychus urticae or Panonychus ulmi and RAST+ to D. ptero",,,,,,,
504,"2226-1","Patients allergiques à l'amande et polliniques au bouleau","Patients allergic to almond and who have birch pollinosis",,,,,,,
505,"2227-1","Patients allergiques à la pistache","Patients allergic to pistachio",,,,,,,
506,"2275-1","Patient allergique au latex et au sarrasin","A patient allergic to latex and buckwheat",,,,,,,
507,"2293-1","Patients allergiques à la tomate et sensibilisés (ou allergiques) au latex","Patients allergic to tomato and sensitized (or allergic) to latex",,,,,,,
508,"2297-1","Patient avec sensibilisation professionnelle à Bombus terrestris","A patient with occupational allergy to Bombus terrestris",,,,,,,
509,"2297-2","Patient avec sensibilisation Bombus pennsylvatica","A patient with sensitivity to Bombus pennsylvatica",,,,,,,
510,"2362-1","Patients avec asthme du boulanger","Patients with baker's asthma",,,,,,,
511,"2384-1","Patients ""sensibilisés"" à l'arachide ou à la pistache ou à la noisette ou à la noix de cajou","Patients ""sensitized"" to peanut or pistachio or hazelnut or cashew nut",,,,,,,
512,"2473-1","Sujets CAP positifs pour Vespula et abeille","Subjects CAP+ for Vespula and bee",,,,,,,
513,"2638-1","Sujets allergiques à la noisette et polliniques (platane, graminées)","Subjects allergic to hazelnut and with pollinosis (platanus, grasses)",,,,,,,
514,"2645-1","Sujets polliniques (platane, graminées) allergiques à la cerise","Subjects with pollinosis (platanus, grasses) and allergy to cherries",,,,,,,
515,"2666-1","Patients avec rhinite/asthme et IgE+ pour rPlo i","Patients with rhinitis/asthma and +IgE for rPlo i",,,,,,,
516,"2677-1","Patient avec ABPA et ""sensibilisé"" à Aspergillus","A patient with ABPA and ""sensitivity"" to Aspergillus",,,,,,,
517,"2700-1","2 enfants non allergiques au lait de vache ayant fait des réactions à des produits laitiers issus du lait de chèvre","Two children not allergic to cow's milk who have had reactions to food products made from goat's milk",,,,,,,
518,"2753-1",,,"Manquent détails (résumé possésé seulement)","Details missing (only the abstract available)",,,,,
519,"2755-1","Sujets TC positifs pour Cladosporium, Aspergillus et/ou Alternaria","Subjects ST+ for Cladosporium, Aspergillus and/or Alternaria",,,,,,,
520,"2756-1","Sérum d'un sujet positif in vitro pour rJun o 4 et rAln g 4","Serum of a subject + in vitro for rJuno 4 and rAln g 4",,,,,,,
521,"2757-1","Polliniques aux graminées","Subjects with grass pollinosis",,,,,,,
522,"2761-1","Patients polliniques aux graminées","Patients with grass pollinosis",,,,,,,
523,"2762-1","Patients allergiques à l'ambroisie","Patients allergic to ragweed",,,,,,,
524,"2763-1","Sujets avec un TC positif pour diverses graminées tempérées et tropicales","Subjects with a +ST for various temperate and tropical grasses",,,,,,,
525,"2765-1","Sujets polliniques aux graminées et positifs pour le pollen de seigle","Subjects with grass pollinosis and positive for rye pollen",,,,,,,
526,"2766-1",,,"Manquent détails (résumé possésé seulement)","Details missing (only the abstract available)",,,,,
527,"2769-1","Sujets positifs pour différentes Oléacées","Subjects positive for various Oleaceae",,,,,,,
528,"2872-1","Pollinose à l'olivier et au chénopode","Pollinosis due to olive and Chenopodium",,,,,,,
529,"2873-1",,,"Manquent détails (résumé possésé seulement)","Details missing (only the abstract available)",,,,,
530,"2887-1","Patients asthmatiques","Asthmatic patients",,,,,,,
531,"2895-1","Patients allergiques à la noisette (TPODA+)","Patients allergic to hazelnut (DBOFC)",,,,,,,
532,"2895-2","Patients ayant montré une réaction sévère à la noisette","Patients having had a severe reaction to hazelnut",,,,,,,
533,"2909-1","Sujets polliniques (dont platane) et présentant des réactions alimentaires","Pollinosis subjects (including platanus) and Chenopodium",,,,,,,
534,"2918-1","Anaphylaxie aux graines de tournesol","Anaphylaxis due to sunflower seeds",,,,,,,
535,"2920-1","Multi-polliniques (armoise, et/ou platane et/ou pariétaire et/ou chénopode, etc..)","Multi-pollinosis (mugwort and/or platanus and/or parietaria and/or Chenopodium",,,,,,,
536,"2935-1","Allergie au platane","Allergy to platanus",,,,,,,
537,"2936-1","Patiente présentant une réaction anaphylactique aux épinards","A patient presenting with an anaphylactic reaction to spinach",,,,,,,
538,"2942-1","Patients présentant un syndrome latex-fruits","Patients presenting with a latex-fruit syndrome",,,,,,,
539,"2943-1","Sujets allergiques au latex","Subjects allergic to latex",,,,,,,
540,"2945-1","Syndrome oral tomate avec pollinose cèdre du Japon","Oral allergy syndrome due to tomato plus pollinosis due to Japanese cedar",,,,,,,
541,"2947-1","Patients polliniques avec RAST positif pour la noix de Nan Gai (bien que n'ayant jamais été en son contact)","Subjects with pollinosis and RAST+ to galip nut",,,,,,,
542,"2948-1","Sujets allergiques au cochon d'Inde","Subjects allergic to guinea pigs",,,,,,,
543,"2950-1","Une patiente avec allergie professionnelle au latex et syndrome latex-fruits","a patient with occupational allergy to latex and a latex-fruit syndrome",,,,,,,
544,"2950-2","Patient pollinique aux graminées sans allergie au latex","A patient with grass pollinosis without allergy to latex",,,,,,,
545,"2955-1","Sujet atopique CAP positif latex et litchi","An atopic subject who is CAP+ to latex and lichee",,,,,,,
546,"3058-1",,,"Données inexploitables: pool de 180 sujets ???","Data inexploitable: pool of 180 subjects???",,,,,
547,"3067-1","Polliniques au bouleau avec syndrome oral à divers aliments et RAST positif pour rBet v 6","Subjects with birch pollinosis and oral allergy syndrome to various foods and RAST+ for rBet v 6",,,,,,,
548,"3121-1",,,"Données inexploitables: inhibition réalisée avec un jus de pêche et non un extrait !","Data inexploitable: inhibition done with peach juice, not an extract!",,,,,
549,"3195-1","Patient asthmatique","An asthmatic patient",,,,,,,
550,"3204-1","Patients asthmatiques et RAST+ pour Penicillium","Asthmatic patients with a +RAST for Penicillium",,,,,,,
551,"3215-1","Patients allergiques au latex, ou au ricin, ou à la mercuriale","Patients allergic to latex, ricin or mercury [??]",,,,,,,
552,"3281-1","Allergie professionnelle à l'anis","Occupational allergy to anise",,,,,,,
553,"3282-1","Pollinose printannière avec TC et/ou RAST positif pour le frêne","Spring pollinosis with ST and/or RAST + for ash tree",,,,,,,
554,"3344-1","Patients allergiques aux fruits à coque","Patients allergic to tree nuts",,,,,,,
555,"3346-1","Patients polliniques présentant des réactions à l'ananas et/ou à la banane mais non allergiques au latex","Patients with pollinosis presenting with reactions to pineapple and/or banana but not allergic to latex",,,,,,,
556,"3367-1",,,"Manquent détails (résumé possésé seulement)","Details missing (only the abstract available)",,,,,
557,"3375-1","Sujets allergiques aux lentilles","Subjects allergic to lentils",,,,,,,
558,"3403-1",,,"Manquent détails (résumé possésé seulement)","Details missing (only the abstract available)",,,,,
559,"3410-1","Sujets allergiques au pollen de palmier","Subjects allergic to palm pollen",,,,,,,
560,"3446-1","Patients avec allergie respiratoire","Patients with respiratory allergy",,,,,,,
561,"3516-1","Une patiente avec anaphylaxie après ingestion de figue (séchée). Pas d'allergie au latex","A patient with anaphylaxis after eating a dried fig. Not allergic to latex",,,,,,,
562,"3568-1",,,"Pas de RC testée","CR not assayed",,,,,
563,"3570-1","?","?",,,,,,,
564,"3571-1","Patients allergiques à la courgette","Patients allergic to zucchini",,,,,,,
565,"3593-1","Patients allergiques à la pêche et polliniques à l'armoise","Patients allergic to peach with pollinosis to mugwort ",,,,,,,
566,"3593-2","Patients allergiques à la pêche et polliniques à l'armoise","Patients allergic to peach with pollinosis to mugwort ",,,,,,,
567,"3593-3","Patients allergiques à la pêche et polliniques à l'armoise","Patients allergic to peach with pollinosis to mugwort ",,,,,,,
568,"3688-1","(Niederberger, preliminary analysis, unpublished data)","(Neiderberger, preliminary analysis, unpublished data)",,,,,,,
569,"3713-1","Professionnels de la boulangerie","Bakers",,,,,,,
570,"3716-1","Patients avec ABPA ou dermatite atopique et ""sensibilisés"" à Aspergillus fumigatus","Patients with ABPA or atopic dermatitis and ""sensitized"" to Aspergillus fumigatus",,,,,,,
571,"3725-1","Sujets allergiques aux rosacées non sensibilisés au bouleau","Subjects allergic to Rosaceae but not birch-sensitized",,,,,,,
572,"3763-1","Asthme et/ou rhinite et TC+ Blomia et D ptero","Asthma and/or rhinitis and ST+ to Blomia and D. pteronyssinus",,,,,,,
573,"3770-1","Un cas d'urticaire généralisée due à la noix du Brésil","A case of generalized urticaria due to Brazil nuts",,,,,,,
574,"3771-1","Pollinose au chénopode avec réactions alimentaires","Chenopodium pollinosis with reactions to food",,,,,,,
575,"3800-1","Sujet atopique présentant une allergie au champignon Agaricus","An atopic subject presenting with allergy to Agaricus mushrooms",,,,,,,
576,"3802-1","Patients avec allergie respiratoire et TC positifs à différentes moisissures","Patients with respiratory allergy and +ST to various molds",,,,,,,
577,"3810-1","Polliniques olivier","Olive pollinosis",,,,,,,
578,"3815-1","Sujets positifs pour Hev b 2","Subjects + for Hev b 2",,,,,,,
579,"3900-1","Anaphylaxie vis à vis d'un supplément nutritionnel contenant un isolat de soja","Anaphylaxis related to a nutrional supplement containing soy isolate",,,,,,,
580,"3902-1","Enfant présentant rhinite et asthme","A child with rhinitis and asthma",,,,,,,
581,"3939-1","Un patient pollinique et allergique au céleri","A pollinosisi patient allergic to celery",,,,,,,
582,"3978-1","Sujets TC+ Tetranychus (non exposés) et TC+ acariens","Subjects ST+ to Tetranychus (not exposed) and ST+ to mites",,,,,,,
583,"3983-1",,,"Pas de RC testée ou méthodologie non conforme","CR not assayed or non-conforming method",,,,,
584,"4008-1","Sujets allergiques au latex (professionnels de santé) et CAP positifs pomme de terre","Subjects allergic to latex (health care professionals) and CAP+ for potato",,,,,,,
585,"4013-1",,,"Pas de RC testée ou méthodologie non conforme","CR not assayed or non-conforming method",,,,,
586,"4055-1","Sujets allergiques aux crevettes et IgE+ pour nPen m 2","Subjects allergic to shrimp and IgE+ for nPen m 2",,,,,,,
587,"4113-1","Sujets TC positifs pour Cladosporium et Aspergillus fumigatus","Subjects ST+ for Cladosporium and Aspergillus fumigatus",,,,,,,
588,"4126-1","Sujets polliniques à l'armoise","Subjects with mugwort pollinosis",,,,,,,
589,"4166-1","Sujets allergiques au raisin (ou au vin) et à la pêche","Subjects allergic to grapes (or to wine) and to peach",,,,,,,
590,"4166-2","Sujets allergiques au raisin (ou au vin) et à la pêche","Subjects allergic to grapes (or to wine) and to peach",,,,,,,
591,"4166-3","Sujets allergiques au raisin (ou au vin) et à la pêche","Subjects allergic to grapes (or to wine) and to peach",,,,,,,
592,"4168-1","Allergie au pois","Allergy to peas",,,,,,,
593,"4197-1",,,"Manquent détails (résumé possésé seulement)","Details missing (only the abstract available)",,,,,
594,"4258-1",,,"Manquent détails (résumé possésé seulement)","Details missing (only the abstract available)",,,,,
595,"4269-1",,,"Manquent détails (résumé possésé seulement)","Details missing (only the abstract available)",,,,,
596,"4353-1","Sujets allergiques au latex et à la gomme gutte","Subjects allergic to latex and gamboge",,,,,,,
597,"4373-1",,,"Données inexploitables","Data inexploitable",,,,,
598,"4374-1","Enfants CAP+ blatte germanique et crustacés","Children with +ACP for German cockroach and shellfish",,,,,,,
599,"4388-1","Patients avec un TC+ pour D. pteronyssinus","Patients with a +ST for D. pteronyssinus",,,,,,,
600,"4391-1","Patients avec syndrome oral melon","Patients with oral allergy syndrome from melon",,,,,,,
601,"4396-1",,,"Manquent détails (résumé possésé seulement)","Details missing (only the abstract available)",,,,,
602,"4407-1","Sérums positifs pour le plantain","Sera positive for platanus",,,,,,,
603,"4412-1","Sujets TC positifs pour différentes moisissures","Subjects ST+ for various molds",,,,,,,
604,"4413-1","Patient allergique à la citrouille","A patient allergic to pumpkin",,,,,,,
605,"4420-1","Anaphylaxie à l'ackee","Anaphylaxis to ackee",,,,,,,
606,"4422-1","Patient allergique aux feuilles de bette (vapeurs de cuisson)","Patients allergic to leaves of Swiss chard (cooking vapours)",,,,,,,
607,"4427-1","Patients présentant une ABPA","Patients presenting with ABPA",,,,,,,
608,"4427-2","Sujets ""sensibilisés"" à Aspergillus fumigatus","Subjects ""sensitized"" to Aspergillus fumigatus",,,,,,,
609,"4434-1","Patients allergiques au céleri, polliniques à l'armoise mais pas au bouleau","Patients allergic to celery, with mugwort pollinosis but not to birch",,,,,,,
610,"4434-2","Patients allergiques au céleri, polliniques  au bouleau mais pas à l'armoise","Patients allergic to celery, with birch but not mugwort pollinosis",,,,,,,
611,"4452-1","Sujets allergiques aux patelles et aux acariens","Subjects allergic to limpets and to mites",,,,,,,
612,"4453-1","1 patiente allergique au hamster et à la viande de cheval","One patient allergic to hamster and to horse meat",,,,,,,
613,"4488-1","Patients positifs in vitro pour le dactyle et le platane","Patients + in vitro for Bermuda grass and London plane",,,,,,,
614,"4497-1","Enfant allergique aux pignons de pin","A child allergic to pine nuts",,,,,,,
615,"4502-1",,,"Données inexploitables","Data inexploitable",,,,,
616,"4508-1","Anaphylaxie aux isolats de blé","Anaphylaxis due to wheat isolates",,,,,,,
617,"4510-1","Sujets TC positifs pour la moutarde","Subjects ST+ for mustard",,,,,,,
618,"4513-1","Patients avec une dermatite atopique et positifs pour Malassezia","Patients with atopic dermatitis and + for Malassezia",,,,,,,
619,"4516-1","Patients allergiques à l'œuf","Patients allergic to eggs",,,,,,,
620,"4517-1","Patients allergiques à l'œuf de poule","Patients allergic to hen's eggs",,,,,,,
621,"4576-1","Poliniques bouleau avec syndrome oral pour l'endive","Birc pollinosis with oral allergy syndrome for chicory",,,,,,,
622,"4590-1","Sujets allergiques à la laitue avec en blot une bande 9kD","Subjecs allergic to lettuce with a blot on a 9 kDa band",,,,,,,
623,"4631-1","2 enfants allergiques au lait de vache et CAP+ chien","Two children allergic to cow's milk and CAP+ to dog  ",,,,,,,
624,"4632-1","1 enfant allergique aux laits de chèvre et de brebis et devenu tolérant au lait de vache","One child allergic to goat's and sheep's milk who became tolerant to cow's milk ",,,,,,,
625,"4662-1","Allergie au poisson vérifiée par TPODA","Fish allergy confirmed by DBOFC",,,,,,,
626,"4668-1",,,"Données inexploitables","Data inexploitable",,,,,
